{
  "schemaVersion": 1,
  "kind": "remote-cast.session",
  "sessionId": "rc-sess-0000000000000002",
  "status": "pairing",
  "emitterId": "rc-dev-000000000001",
  "receiverId": "rc-dev-000000000002",
  "updatedAt": "2026-08-11T10:02:00Z",
  "pairing": {
    "mode": "pairing-code",
    "code": "A3F9K2",
    "expiresAt": "2026-08-11T10:07:00Z",
    "attemptsRemaining": 3,
    "deviceBound": false
  }
}
