{
  "schemaVersion": 1,
  "kind": "remote-cast.session",
  "sessionId": "rc-sess-0000000000000004",
  "status": "awaiting-consent",
  "emitterId": "rc-dev-000000000001",
  "receiverId": "rc-dev-000000000002",
  "updatedAt": "2026-08-11T10:05:00Z",
  "pairing": {
    "mode": "pairing-code",
    "code": "M7Q2X9",
    "expiresAt": "2026-08-11T10:10:00Z",
    "attemptsRemaining": 2,
    "deviceBound": true,
    "boundDeviceId": "rc-dev-000000000002"
  },
  "consent": {
    "grantedByEmitter": false,
    "grantedByReceiver": false,
    "permissions": {
      "video": true,
      "audio": false,
      "input": false,
      "remoteControl": false,
      "clipboard": false,
      "files": false,
      "elevated": false
    }
  }
}
