{
  "schemaVersion": 1,
  "kind": "remote-cast.session",
  "sessionId": "rc-sess-0000000000000007",
  "status": "relayed",
  "emitterId": "rc-dev-000000000001",
  "receiverId": "rc-dev-000000000002",
  "updatedAt": "2026-08-11T10:15:00Z",
  "consent": {
    "grantedByEmitter": true,
    "grantedByReceiver": true,
    "permissions": {
      "video": true,
      "audio": true,
      "input": false,
      "remoteControl": false,
      "clipboard": false,
      "files": false,
      "elevated": false
    }
  },
  "transport": {
    "mode": "relay",
    "relay": {
      "relayId": "rc-relay-000000000001",
      "region": "us-east-1",
      "encrypted": true
    },
    "lastSwitch": {
      "from": "direct",
      "to": "relay",
      "at": "2026-08-11T10:15:00Z",
      "reason": "direct-to-relay"
    },
    "quality": {
      "bitrateKbps": 2200,
      "ceilingKbps": 10000,
      "latencyMs": 74,
      "keyframeRequested": true
    }
  },
  "auth": {
    "established": true,
    "cipher": "aes-256-gcm",
    "keyRotation": {
      "rotations": 4,
      "lastRotatedAt": "2026-08-11T10:14:00Z"
    }
  }
}
