{
  "schemaVersion": 1,
  "kind": "remote-cast.session",
  "sessionId": "rc-sess-0000000000000003",
  "status": "pairing",
  "emitterId": "rc-dev-000000000001",
  "receiverId": "rc-dev-000000000002",
  "updatedAt": "2026-08-11T10:03:00Z",
  "pairing": {
    "mode": "qr",
    "code": "Q7M2X9",
    "qrToken": "rc-qr-0000000000000001",
    "expiresAt": "2026-08-11T10:08:00Z",
    "attemptsRemaining": 5,
    "deviceBound": true,
    "boundDeviceId": "rc-dev-000000000002"
  }
}
