{
  "schemaVersion": 1,
  "kind": "remote-cast.session",
  "sessionId": "rc-sess-0000000000000008",
  "status": "degraded",
  "emitterId": "rc-dev-000000000001",
  "receiverId": "rc-dev-000000000002",
  "updatedAt": "2026-08-11T10:18:00Z",
  "consent": {
    "grantedByEmitter": true,
    "grantedByReceiver": true,
    "permissions": {
      "video": true,
      "audio": true,
      "input": false,
      "remoteControl": false,
      "clipboard": false,
      "files": false,
      "elevated": false
    }
  },
  "transport": {
    "mode": "direct",
    "direct": {
      "protocol": "webrtc",
      "remoteEndpointRef": "ref:rc-endpoint-000000000001",
      "encrypted": true
    },
    "quality": {
      "bitrateKbps": 850,
      "ceilingKbps": 10000,
      "latencyMs": 180,
      "keyframeRequested": true
    }
  },
  "degradation": {
    "reason": "quality",
    "impact": "media",
    "at": "2026-08-11T10:18:00Z"
  },
  "auth": {
    "established": true,
    "cipher": "aes-256-gcm",
    "keyRotation": {
      "rotations": 4,
      "lastRotatedAt": "2026-08-11T10:17:30Z"
    }
  }
}
